University of California-Davis,Food Science,1758,"California Polytechnic State University, San Luis Obispo",Environmental Engineering (Environmental Engineering - General),1603,University of California-San Diego,Marine Biology,2602,Sonoma State University,Art (Art Studio),240,"California State University, Long Beach",Industrial Design (Industrial Design - General),2113,"California State University, Los Angeles",Music (General),2834,"California State University, Monterey Bay",Humanities and Communication (Journalism and Media Studies),2103,"California State University, San Bernardino",Music (Vocal Performance),2922,"California State University, Dominguez Hills",English (English Education),1529,San Diego State University,Criminal Justice (Criminal Justice (San Diego Campus)),1247,"California State University, Los Angeles",Social Work (General),3507,"California Polytechnic State University, San Luis Obispo",Anthropology-Geography (Individualized Course of Study),164,Sonoma State University,Physics (Astrophysics),3155,University of California-Los Angeles,Bioengineering,402,University of California-San Diego,Chemical Engineering,813,San Diego State University,Geography (Geographic Information Science and Technology),1838,"California Polytechnic State University, San Luis Obispo",Bioresource and Agricultural Engineering (Bioresource and Agricultural Engineering - General),540,University of California-Berkeley,Mechanical Engineering,2729,"California State University, Chico",Computer Animation and Game Development (Animation Production),1130,University of California-Berkeley,Urban Studies,3751,"California State University, Los Angeles",Chicana(o) and Latina(o) Studies (Elementary Subject Matter Teacher Preparation: Traditional),911,San José State University,Sociology (Women Gender and Sexuality Studies),3586,"California State University, Fresno",Philosophy (Philosophy),3106,"California State University, Long Beach",French and Francophone Studies (General),1803,"California State Polytechnic University, Pomona",Anthropology (General Anthropology),150,San José State University,Interdisciplinary Studies (Interdisciplinary Studies),2164,"California State University, Long Beach",Communication Studies (Communication Culture and Public Affairs),1088,"California State University, Dominguez Hills",Political Science (Political Science - General),3248,California State University San Marcos,Sociology (Health Education and Welfare),3550,University of California-Los Angeles,Linguistics and Anthropology,2558,"California State University, Chico",Business Administration (Management (Degree Completion)),693,"California State University, Long Beach",Business Administration (Finance),635,San Francisco State University,Apparel Design/Merchandising (Design),166,University of California-San Diego,Real Estate and Development,3399,"California Polytechnic State University, San Luis Obispo",Nutrition (Nutrition Science),3026,"California State University, Fullerton",Psychology (Psychology - General),3322,"California State University, Dominguez Hills",Child Development (Child Development - General),946,"California State University, Chico",Kinesiology (Movement Studies),2318,"California State University, East Bay",Statistics (Data Science),3655,"California State University, Northridge",Mathematics (Applied Mathematical Sciences),2645,Sonoma State University,Economics (Economics - General),1406,,
University of California-Davis,Food Science,1759,"California State University, San Bernardino",Environmental Health Science (Environmental Health Science - General),1604,University of California-Santa Cruz,Marine Biology,2603,"California State University, Long Beach",Art (Ceramics),241,San José State University,Industrial Design (Industrial Design - General),2114,"California State University, San Bernardino",Music (General),2835,"California Polytechnic State University, San Luis Obispo",Interdisciplinary Studies (Visual Media and Cultural Studies),2169,"California State University, Stanislaus",Music (Vocal Performance),2923,"California State Polytechnic University, Humboldt",English (English Education),1530,San Diego State University,Criminal Justice (Criminal Justice),1248,"California State University, San Bernardino",Social Work (General),3508,"California Polytechnic State University, San Luis Obispo",Anthropology-Geography (Teaching),165,University of California-Santa Cruz,Physics (Astrophysics),3156,University of California-Merced,Bioengineering,403,University of California-Santa Barbara,Chemical Engineering,814,"California State Polytechnic University, Humboldt",Geospatial Science and Technology (Environmental Science and Management),1912,University of California-Berkeley,Chemical Engineering,807,University of California-Davis,Mechanical Engineering,2730,"California State University, Chico",Computer Animation and Game Development (Game Development),1131,University of California-Berkeley,Urban Studies,3752,"California State University, Los Angeles",Chicana(o) and Latina(o) Studies (General),912,California State University San Marcos,Women's Gender and Sexuality Studies (General),3783,"California State Polytechnic University, Humboldt",Philosophy (Philosophy),3107,"California State University, Long Beach",French and Francophone Studies (Interdisciplinary),1804,"California State University, Los Angeles",Anthropology (General),151,San José State University,Interdisciplinary Studies (Interdisciplinary Studies),2165,"California State University, Fullerton",Communication Studies (Communication Studies - General),1089,"California State University, Fullerton",Political Science (Political Science - General),3249,"California State University, Bakersfield",Sociology (Human Services),3551,University of California-Los Angeles,Linguistics and Anthropology,2559,San Diego State University,Business Administration (Management (Entrepreneurship)),694,"California State University, Los Angeles",Business Administration (Finance),636,San Francisco State University,Apparel Design/Merchandising (Merchandising),167,University of California-San Diego,Real Estate and Development,3400,San Francisco State University,Nutrition and Dietetics (Dietetics and Nutrition Science),3027,"California State University, Long Beach",Psychology (Psychology - General),3323,San Diego State University,Child Development (Child Development - General),947,"California State University, Sacramento",Kinesiology (Physical Activity and Wellness),2319,San Diego State University,Statistics (Data Science),3656,California State University Channel Islands,Mathematics (Applied Mathematics),2646,San Francisco State University,Economics (Economics 4+1),1407,,
"California Polytechnic State University, San Luis Obispo",Food Science (Advanced Food Science),1760,"California Polytechnic State University, San Luis Obispo",Environmental Management and Protection (Environmental Management and Protection - General),1605,"California State University, Long Beach",Marine Biology (Marine Biology - General),2604,"California State University, Dominguez Hills",Art (Design Option),242,San Francisco State University,Industrial Design (Product Design and Development),2115,California State University San Marcos,Music (General),2836,"California Polytechnic State University, San Luis Obispo",Journalism (Media Innovation),2263,California State University Channel Islands,Performing Arts (Dance),3060,"California State University, Long Beach",English (English Education),1531,"California State University, Stanislaus",Criminal Justice (Criminal Legal Studies),1249,"California State University, Chico",Social Work (Social Work - General),3509,Sonoma State University,Environmental Science Geography and Management (General),1637,"California State University, Los Angeles",Physics (Biophysics),3157,University of California-Merced,Bioengineering,404,"California State University, Long Beach",Chemical Engineering (Chemical Engineering - General),815,"California State Polytechnic University, Humboldt",Geospatial Science and Technology (Social Science),1913,University of California-Davis,Chemical Engineering,808,University of California-Irvine,Mechanical Engineering,2731,University of California-Davis,Computer Engineering,1132,University of California-Irvine,Urban Studies,3753,San Francisco State University,Latina/Latino Studies (Latina/Latino Studies),2390,"California State University, Long Beach",Women's Gender and Sexuality Studies (Women's Gender and Sexuality Studies - General),3784,San José State University,Philosophy (Philosophy),3108,University of California-Los Angeles,French and Linguistics,1805,"California State University, Northridge",Anthropology (General),152,"California Polytechnic State University, San Luis Obispo",Interdisciplinary Studies (Science Technology and Society),2166,San Francisco State University,Communication Studies (Communication Studies - General),1090,"California State University, Long Beach",Political Science (Political Science - General),3250,"California State University, Stanislaus",Sociology (Human Services),3552,University of California-Los Angeles,Linguistics and Asian Languages and Cultures,2560,San Diego State University,Business Administration (Management (Human Resource Management)),695,"California State University, Sacramento",Business Administration (Finance),637,"California State Polytechnic University, Pomona",Apparel Merchandising and Management (Apparel Production and Management),168,"California State University, San Bernardino",Administration (Hospitality Management),9,San Francisco State University,Nutrition and Dietetics (Foods and Community Nutrition),3028,"California State University, Monterey Bay",Psychology (Psychology - General),3324,San Diego State University,Child Development (Child Development - General),948,"California State University, Bakersfield",Kinesiology (Physical Activity Leadership),2320,University of California-Santa Barbara,Statistics and Data Science,3665,"California State University, Chico",Mathematics (Applied Mathematics),2647,"California State University, Fresno",Economics (Economics),1408,,
"California Polytechnic State University, San Luis Obispo",Food Science (Culinology),1761,"California Polytechnic State University, San Luis Obispo",Environmental Management and Protection (Watershed Management and Hydrology),1606,San José State University,Marine Biology (Marine Biology - General),2605,"California State University, East Bay",Art (Design),243,"California State University, Fresno",Integrated Design (Integrated Design - General),2139,San Diego State University,Music (Global Composition),2837,San Diego State University,Journalism (Media Studies),2264,California State University Channel Islands,Performing Arts (Music),3061,"California State Polytechnic University, Pomona",English (English Education),1532,"California State University, Los Angeles",Criminal Justice (degree completion program) (Criminal Justice (degree completion program) - General - DTLA Campus),1250,"California State University, Long Beach",Social Work (Social Work - General),3510,Sonoma State University,Environmental Studies Geography and Planning (General),1663,"California State Polytechnic University, Pomona",Physics (Biophysics),3158,University of California-Riverside,Bioengineering,405,"California State Polytechnic University, Pomona",Chemical Engineering (Chemical Engineering - General),816,"California Polytechnic State University, San Luis Obispo",Graphic Communication (Design Reproduction Technology),1957,University of California-Irvine,Chemical Engineering,809,University of California-Los Angeles,Mechanical Engineering,2732,University of California-Irvine,Computer Engineering,1133,San Diego State University,Urban Studies (Urban Cultures and Societies),3754,San Diego State University,Asian Studies (Chinese Studies),348,"California State University, Los Angeles",Women's Gender and Sexuality Studies (Women's Gender and Sexuality Studies - General),3785,Sonoma State University,Philosophy (Pre-Law and Ethics),3109,"California State University, Northridge",Languages and Cultures (French),2361,"California State University, San Bernardino",Anthropology (General),153,"California State University, Northridge",Interdisciplinary Studies (Special Major),2167,"California Polytechnic State University, San Luis Obispo",Communication Studies (Communication Studies - General),1091,"California State Polytechnic University, Pomona",Political Science (Political Science - General),3251,"California Polytechnic State University, San Luis Obispo",Sociology (Individualized Course of Study),3553,University of California-Los Angeles,Linguistics and Asian Languages and Cultures,2561,"California State University, Dominguez Hills",Business Administration (Management and Human Resources Concentration),696,San Diego State University,Business Administration (Finance),638,"California State Polytechnic University, Pomona",Apparel Merchandising and Management (Fashion Retailing),169,"California State University, Fullerton",Business Administration (Entertainment & Hospitality Management),616,"California State University, Sacramento",Nutrition and Food (Dietetics),3029,"California State Polytechnic University, Pomona",Psychology (Psychology - General),3325,"California Polytechnic State University, San Luis Obispo",Child Development (Child Development - General),949,"California State University, San Bernardino",Kinesiology (Physical Education and Adapted Physical Education),2321,University of California-Santa Barbara,Actuarial Science,2,"California State University, Fullerton",Mathematics (Applied Mathematics),2648,"California State Polytechnic University, Humboldt",Economics (Economics),1409,,
"California State Polytechnic University, Pomona",Food Science and Technology (Culinology),1762,"California Polytechnic State University, San Luis Obispo",Environmental Management and Protection (Wildlife Biology),1607,"California State Polytechnic University, Humboldt",Marine Biology (Marine Biology),2606,San José State University,Art (Digital Media Art),244,"California State University, Northridge",Interior Design (General),2173,"California State University, San Bernardino",Music (Guitar Performance),2838,"California State University, Fresno",Mass Communication & Journalism (Film and Media Arts),2615,California State University Channel Islands,Performing Arts (Theatre),3062,San Francisco State University,English (English Education),1533,"California State University, Stanislaus",Criminal Justice (Forensic Science),1251,"California State University, Sacramento",Social Work (Social Work - General),3511,University of California-Berkeley,Geography,1826,"California State University, Dominguez Hills",Physics (Electrical Engineering),3159,University of California-Riverside,Bioengineering,406,San José State University,Chemical Engineering (Chemical Engineering 4+1),817,"California State University, Dominguez Hills",Health Science (Radiologic Technology),1980,University of California-Los Angeles,Chemical Engineering,810,University of California-Merced,Mechanical Engineering,2733,University of California-Los Angeles,Computer Engineering,1134,San Diego State University,Urban Studies (Urban Planning Design and Management),3755,University of California-Irvine,Chinese Studies,975,"California State University, Fresno",Women's Gender and Sexuality Studies (Women's Gender and Sexuality Studies),3786,"California State University, Fresno",Philosophy (Prelaw),3110,University of California-Riverside,Languages and Literatures/French,2370,"California State University, Stanislaus",Anthropology (General),154,San Diego State University,Interdisciplinary Studies (Three Departments),2168,Sonoma State University,Communication Studies (Communication Studies - General),1092,"California State University, Sacramento",Political Science (Political Science - General),3252,"California State University, Los Angeles",Sociology (Inequalities and Diversity),3554,University of California-Los Angeles,Linguistics and Computer Science,2562,"California State Polytechnic University, Pomona",Business Administration (Management and Human Resources),697,San Francisco State University,Business Administration (Finance),639,"California State Polytechnic University, Pomona",Apparel Merchandising and Management (Textiles),170,San José State University,Business Administration (Hospitality Tourism and Event Management),666,"California State University, Sacramento",Nutrition and Food (Nutrition and Food - General),3030,"California State University, Sacramento",Psychology (Psychology - General),3326,"California State University, Stanislaus",Child Development (Child Development Early Childhood Track),950,"California State University, Chico",Kinesiology (Physical Education Teacher Education),2322,"California State University, Fullerton",Mathematics (Actuarial Science),2643,"California State University, Long Beach",Mathematics (Applied Mathematics),2649,San José State University,Economics (Economics),1410,,
"California State University, Los Angeles",Food Science and Technology (General),1763,University of California-Davis,Environmental Policy Analysis and Planning,1608,California State University Maritime Academy,Marine Engineering Technology (Marine Engineering Technology - General),2607,"California State University, Long Beach",Art (Drawing and Painting),245,"California State University, Long Beach",Interior Design (Interior Design - General),2174,"California State University, Long Beach",Music (History and Literature),2839,University of California-Riverside,Media and Cultural Studies,2763,University of California-Berkeley,Theater and Performance Studies,3686,California State University Channel Islands,English (English Educational Preparation),1534,"California State University, Los Angeles",Criminal Justice (General),1252,San Diego State University,Social Work (Social Work - General),3512,University of California-Los Angeles,Geography,1827,"California State University, Stanislaus",Physics (Environmental Sciences),3160,University of California-San Diego,Bioengineering,407,San José State University,Chemical Engineering (Chemical Engineering),818,"California State University, Fresno",Industrial Technology (Industrial Technology - General),2121,University of California-Riverside,Chemical Engineering,811,University of California-Riverside,Mechanical Engineering,2734,University of California-Riverside,Computer Engineering,1135,San Diego State University,Urban Studies (Urban Political Economy and Public Policy),3756,University of California-San Diego,Chinese Studies,976,University of California-Santa Barbara,Feminist Studies,1734,"California State University, Los Angeles",Philosophy (Prelaw),3111,University of California-Los Angeles,Linguistics and French,2564,California State University San Marcos,Anthropology (Indigenous Anthropology),155,"California Polytechnic State University, San Luis Obispo",Interdisciplinary Studies (Visual Media and Cultural Studies),2169,San José State University,Communication Studies (Communication Studies),1093,San Diego State University,Political Science (Political Science - General),3253,"California State University, Los Angeles",Sociology (Law and Society),3555,University of California-Los Angeles,Linguistics and English,2563,"California Polytechnic State University, San Luis Obispo",Business Administration (Management and Human Resources),698,San José State University,Business Administration (Finance),640,"California State University, Northridge",Family and Consumer Sciences (Apparel Design and Merchandising),1725,"California State University, Dominguez Hills",Business Administration (Sports Entertainment and Hospitality Management),768,"California State University, Chico",Nutrition and Food Sciences (Food and Nutrition Communication),3031,San Francisco State University,Psychology (Psychology - General),3327,"California State University, Stanislaus",Child Development (Child Development General Track),951,"California State Polytechnic University, Pomona",Kinesiology (Physical Education Teacher Education),2323,San Diego State University,Statistics (Actuarial Science),3654,"California State University, Los Angeles",Mathematics (Applied Mathematics),2650,San José State University,Economics (Economics),1411,,
"California State Polytechnic University, Pomona",Food Science and Technology (General),1764,University of California-Davis,Environmental Policy Analysis and Planning,1609,University of California-Berkeley,Marine Science,2608,"California State University, Los Angeles",Art (Fashion Fiber and Materials),246,San Francisco State University,Interior Design (Interior Design - General),2175,"California State University, Los Angeles",Music (Instrumental Performance),2840,"California State University, Chico",Media Arts (Criticism),2764,"California State University, Fullerton",Theatre (Devised Performance/Physical Theatre),3695,"California State Polytechnic University, Humboldt",Environmental Science & Management (Environmental Education and Interpretation),1617,"California State University, San Bernardino",Criminal Justice (General),1253,San Diego State University,Social Work (Social Work - General),3513,University of California-Santa Barbara,Geography,1828,"California State University, Stanislaus",Physics (Environmental Sciences),3161,University of California-Berkeley,Bioengineering & Business Administration,408,University of California-Davis,Chemical Physics,819,"California State University, Los Angeles",Industrial Technology (Industrial Technology - General),2122,University of California-Riverside,Chemical Engineering,812,University of California-Riverside,Mechanical Engineering,2735,University of California-Riverside,Computer Engineering,1136,San Diego State University,Urban Studies (Urban Sustainability),3757,"California State University, Long Beach",Chinese Studies (Chinese Studies - General),977,University of California-Santa Cruz,Feminist Studies,1735,"California State University, East Bay",Philosophy (Religious Studies),3112,University of California-Los Angeles,Linguistics and French,2565,"California State Polytechnic University, Humboldt",Anthropology (Linguistic Anthropology),156,"California State University, Bakersfield",Interdisciplinary Studies (Women Gender and Sexuality Studies),2170,"California State University, Sacramento",Communication Studies (General Communication),1094,San Francisco State University,Political Science (Political Science - General),3254,"California Polytechnic State University, San Luis Obispo",Sociology (Organizations),3556,University of California-Los Angeles,Linguistics and French,2564,"California State University, Monterey Bay",Business Administration (Management and International Business),699,California State University San Marcos,Business Administration (Finance),641,"California State University, Fresno",Fashion Merchandising (Fashion Merchandising - General),1730,"California State University, East Bay",Hospitality and Tourism (Event Planning and Management (Online Degree Completion)),2041,"California State University, Chico",Nutrition and Food Sciences (General Dietetics),3032,Sonoma State University,Psychology (Psychology - General),3328,"California State University, Stanislaus",Child Development (Child Development Middle Childhood Track),952,"California State University, Sacramento",Kinesiology (Physical Education Teacher Education),2324,"California State University, Northridge",Geographic Information Science (General),1825,"California State University, San Bernardino",Mathematics (Applied Mathematics),2651,San José State University,Economics (Economics),1412,,
