,,,"California State University, San Bernardino",Environmental Studies (Environmental Systems),1658,,,,"California State University, Fullerton",Art (Studio/Performance) (Jewelry and Metals),295,,,,San José State University,Music (Music),2889,University of California-Santa Barbara,Film and Media Studies,1743,"California State University, San Bernardino",Music (Vocal Performance),2922,California State University San Marcos,Liberal Studies (Liberal Studies - Integrated Teacher Education Program Option (ITEP)),2480,"California State University, Sacramento",Criminal Justice (Criminal Justice - General),1244,San Francisco State University,Recreation Parks and Tourism Administration (Recreation Parks and Tourism Administration - General),3425,San Diego State University,Geological Sciences (Hydrogeology),1871,"California State Polytechnic University, Humboldt",Physics (Astronomy),3150,"California State University, Chico",Biological Sciences (Plant Biology),457,"California State University, East Bay",Chemistry (Chemistry Education),868,California State University San Marcos,Business Administration (Management Information Systems),703,University of California-Berkeley,Industrial Engineering and Operations Research | Business Administration,2120,,,,"California State Polytechnic University, Humboldt",Computer Science (Computer Science),1185,,,,"California State University, San Bernardino",Ethnic Studies (Ethnic Studies - General),1698,,,,,,,University of California-Riverside,Languages and Literatures/Japanese,2372,University of California-Davis,History,1987,"California State University, Stanislaus",Liberal Studies (English),2437,"California State University, Los Angeles",Journalism (Journalism - General),2258,University of California-San Diego,Environmental Systems â€” Environmental Policy,1671,"California State University, Fresno",Social Science (Social Science),3485,,,,"California State University, Bakersfield",Chemistry (Management and Marketing),894,,,,,,,"California State University, Fresno",Recreation Administration (Sports and Entertainment Facility Management),3417,,,,"California State University, Northridge",Child and Adolescent Development (Applied Developmental Science),926,California State University San Marcos,Nursing (Accelerated Bachelor of Science in Nursing Option),2969,"California State University, East Bay",Biological Science (Physiology),424,,,,"California State University, Fresno",Mathematics (Pure Math),2700,"California State University, Stanislaus",Liberal Studies (Economics),2423,,
,,,California State University San Marcos,Environmental Studies (General),1659,,,,"California State University, Fullerton",Art (Studio/Performance) (Sculpture),296,,,,"California State University, Fresno",Music (Music-Composition),2890,University of California-Los Angeles,Film and Television,1744,"California State University, Stanislaus",Music (Vocal Performance),2923,"California State University, Long Beach",Liberal Studies (Liberal Studies Integrated Teacher Education Program),2482,"California State University, Sacramento",Criminal Justice (Criminal Justice - General),1245,"California Polytechnic State University, San Luis Obispo",Recreation Parks and Tourism Administration (Sport and Recreation Management),3426,San Diego State University,Geological Sciences (Paleontology),1872,San Francisco State University,Physics (Astronomy),3151,San José State University,Biological Sciences (Systems Physiology),458,San Diego State University,Chemistry (Chemistry Integrated Teacher Education Program),869,"California State University, Fullerton",Business Administration (Marketing and Information Systems),720,San José State University,Interdisciplinary Engineering (Interdisciplinary Engineering),2144,,,,San José State University,Computer Science (Computer Science),1186,,,,California State University San Marcos,Ethnic Studies (Ethnic Studies - General),1699,,,,,,,University of California-Riverside,Languages and Literatures/Japanese,2373,University of California-Davis,History,1988,"California Polytechnic State University, San Luis Obispo",Liberal Studies (Environmental Education),2438,San Diego State University,Journalism (Journalism - General),2259,San Diego State University,Geography (Environment Sustainability and Policy),1831,"California State University, Sacramento",Social Science (Social Sciences - General),3486,,,,"California State University, Bakersfield",Chemistry (Occupational Safety and Health Management),898,,,,,,,San Diego State University,Recreation Administration (Sustainable Tourism Management),3418,,,,San José State University,Child and Adolescent Development (Child and Adolescent Development BA+ Early Child Special Education Credential+ Special Education MA),927,"California State University, Stanislaus",Nursing (Accelerated Second Degree),2970,"California Polytechnic State University, San Luis Obispo",Biological Sciences (Anatomy and Physiology),431,,,,California State University Channel Islands,Mathematics (Pure Mathematics),2701,University of California-Merced,Management and Business Economics,2584,,
,,,San Francisco State University,Environmental Studies (Natural Resource Management and Conservation),1660,,,,"California State University, Fullerton",Art (Teaching),297,,,,"California State University, Fresno",Music (Music-Instrumental Performance),2891,"California State University, Dominguez Hills",Film and Television Production (Film and Television Production - General),1745,"California State University, Dominguez Hills",Liberal Studies (Theatre Arts),2523,San Diego State University,Liberal Studies (Multiple Subject Teaching Credential Integrated Teacher Education Program),2493,San Diego State University,Criminal Justice (Criminal Justice (Imperial Valley Campus)),1246,"California Polytechnic State University, San Luis Obispo",Recreation Parks and Tourism Administration (Tourism Hospitality and Destination Management),3427,University of California-Berkeley,Geology,1873,"California State University, Los Angeles",Physics (Astrophysics),3152,University of California-Davis,Biological Sciences A.B.,459,"California State University, Fresno",Chemistry (Chemistry),870,"California State University, East Bay",Business Administration (online degree completion) (Information Technology Management),746,San José State University,Interdisciplinary Engineering (Interdisciplinary Engineering),2145,,,,"California State University, Fullerton",Computer Science (Cybersecurity),1187,,,,San Francisco State University,Ethnic Studies (Ethnic Studies),1700,,,,,,,"California State University, Sacramento",Asian Studies (Korean Studies),351,University of California-Irvine,History,1989,"California State University, Stanislaus",Liberal Studies (Ethnic Studies and Social Justice),2439,"California Polytechnic State University, San Luis Obispo",Journalism (Journalism - General),2260,"California State University, East Bay",Health Sciences (Health Policy),1982,"California State University, Chico",Social Science (Specialization Studies (Online Degree Completion)),3487,,,,"California State University, Dominguez Hills",Child Development (Management and Administration Concentration),961,,,,,,,"California State University, Sacramento",Recreation Administration (Therapeutic Recreation),3419,,,,San José State University,Child and Adolescent Development (Child and Adolescent Development),928,"California State University, Sacramento",Nursing (ADN to BSN),2971,California State University San Marcos,Biological Sciences (Physiology),456,,,,"California State University, Fullerton",Mathematics (Pure Mathematics),2702,University of California-Davis,Managerial Economics,2587,,
,,,San José State University,Environmental Studies (Preparation for Teaching),1661,,,,"California State University, East Bay",Art (Transdisciplinary Arts),298,,,,"California State University, Fresno",Music (Music-Jazz Studies),2892,University of California-Berkeley,Film Studies,1746,"California State University, Sacramento",Liberal Studies (Theatre),2524,"California State University, Dominguez Hills",Liberal Studies (Physical Education),2501,San Diego State University,Criminal Justice (Criminal Justice (San Diego Campus)),1247,"California State University, Monterey Bay",Sustainable Hospitality Management (Sustainable Tourism Management),3676,University of California-Davis,Geology,1874,"California State University, Northridge",Physics (Astrophysics),3153,University of California-Davis,Biological Systems Engineering,460,"California State University, Fresno",Chemistry (Chemistry),871,University of California-Irvine,Business Information Management,781,"California State Polytechnic University, Pomona",Manufacturing Engineering (Manufacturing Engineering - General),2590,,,,"California State University, Stanislaus",Computer Science (Cybersecurity),1188,,,,"California State University, East Bay",Ethnic Studies (Genders and Sexualities in Communities of Color (Online Degree Completion)),1701,,,,,,,University of California-Los Angeles,Korean,2345,University of California-Merced,History,1990,"California State University, Stanislaus",Liberal Studies (Exceptional Children and Youth),2440,"California State University, Sacramento",Journalism (Journalism),2261,University of California-Santa Barbara,History of Public Policy and Law,2039,"California State University, Chico",Social Science (Specialization Studies),3488,,,,"California State University, Northridge",Cinema and Television Arts (Entertainment Media Management),983,,,,,,,"California State University, Chico",Recreation Hospitality and Parks Management (Event Management),3420,,,,San Francisco State University,Child and Adolescent Development (Community Health and Social Services),929,"California State University, Los Angeles",Nursing (ADN-BSN degree completion program),2972,San José State University,Biological Sciences (Systems Physiology),458,,,,"California Polytechnic State University, San Luis Obispo",Mathematics (Pure Mathematics),2703,University of California-Davis,Managerial Economics,2588,,
,,,"California State University, Monterey Bay",Environmental Studies (Sustainable Communities),1662,,,,"California State University, East Bay",Art (Video and Animation),299,,,,"California State Polytechnic University, Pomona",Music (Pedagogy (Pre-credential)),2893,"California State University, Dominguez Hills",Film Television and Media (Film Television and Media - General),1747,"California State University, Stanislaus",Liberal Studies (Theatre),2525,"California State University, Sacramento",Liberal Studies (Physical Education),2502,San Diego State University,Criminal Justice (Criminal Justice),1248,"California State University, Northridge",Tourism Hospitality and Recreation Management (General),3742,University of California-Davis,Geology,1875,San Francisco State University,Physics (Astrophysics),3154,University of California-Davis,Biological Systems Engineering,461,"California State Polytechnic University, Humboldt",Chemistry (Chemistry),872,University of California-Irvine,Business Information Management,782,"California Polytechnic State University, San Luis Obispo",Manufacturing Engineering (Manufacturing Engineering - General),2591,,,,"California Polytechnic State University, San Luis Obispo",Computer Science (Data Engineering),1189,,,,"California State University, East Bay",Ethnic Studies (Genders and Sexualities in Communities of Color),1702,,,,,,,University of California-Irvine,Korean Literature and Culture,2346,University of California-Riverside,History,1991,"California State University, Sacramento",Liberal Studies (Foreign Languages),2441,San José State University,Journalism (Journalism),2262,University of California-Santa Barbara,Hydrologic Sciences and Policy,2107,"California State University, San Bernardino",Social Sciences (Economics (Online)),3489,,,,"California State University, Monterey Bay",Collaborative Health and Human Services (Public Administration & NonProfit Management),1050,,,,,,,"California State University, Chico",Recreation Hospitality and Parks Management (Parks and Recreation Management),3421,,,,San Francisco State University,Child and Adolescent Development (Early Care and Education),930,"California State University, Los Angeles",Nursing (ADN-BSN),2973,"California State University, Long Beach",Biology (Molecular and Cell Biology and Physiology),510,,,,San Diego State University,Mathematics (Science),2704,University of California-Davis,Managerial Economics,2589,,
,,,Sonoma State University,Environmental Studies Geography and Planning (General),1663,,,,"California State University, Stanislaus",Art (Video and Time Based Media),300,,,,"California State University, Northridge",Music (Percussion),2894,"California State University, Fresno",Mass Communication & Journalism (Film and Media Arts),2615,"California State University, Chico",Musical Theatre (Musical Theatre - General),2932,San Diego State University,Liberal Studies (Special Education Extensive Support Needs Integrated Teacher Education Program),2516,"California State University, Stanislaus",Criminal Justice (Criminal Legal Studies),1249,"California State University, Sacramento",Career and Technical Studies (Career and Technical Studies - General),792,University of California-Riverside,Geology,1876,Sonoma State University,Physics (Astrophysics),3155,University of California-Davis,Biological Systems Engineering,462,"California State Polytechnic University, Humboldt",Chemistry (Chemistry),873,University of California-Irvine,Business Information Management (see Interdisciplinary Studies),783,"California State University, Northridge",Manufacturing Systems Engineering (General),2592,,,,"California State University, Monterey Bay",Computer Science (Data Science),1190,,,,"California State University, Sacramento",Ethnic Studies (General Ethnic Studies),1703,,,,,,,University of California-Los Angeles,Portuguese,3284,University of California-San Diego,History,1992,"California State University, Bakersfield",Liberal Studies (General - Non-Teaching Track),2442,"California Polytechnic State University, San Luis Obispo",Journalism (Media Innovation),2263,"California State University, Bakersfield",Philosophy (Law Justice and Social Policy),3094,"California State University, San Bernardino",Social Sciences (Economics),3490,,,,"California State University, Chico",Concrete Industry Management (Concrete Industry Management - General),1221,,,,,,,"California State University, Chico",Recreation Hospitality and Parks Management (Resort and Lodging Management),3422,,,,"California State University, Northridge",Child and Adolescent Development (Early Childhood Development),931,"California State University, Chico",Nursing (Advanced Placement for RN to BSN),2974,"California State University, Los Angeles",Biology (Physiology),514,,,,"California State Polytechnic University, Pomona",Mathematics (Secondary Teacher Prep\Pure Mathematics),2705,"California State University, Bakersfield",Mathematics (Economics),2660,,
,,,University of California-Santa Cruz,Environmental Studies/Biology,1664,,,,"California Polytechnic State University, San Luis Obispo",Art and Design (Graphic Design),301,,,,"California State University, Dominguez Hills",Music (Performance),2895,San José State University,Radio-Television-Film (Radio-Television-Film),3396,California State University Channel Islands,Performing Arts (Theatre),3062,San Diego State University,Liberal Studies (Special Education Mild/Moderate Support Needs Integrated Teacher Education Program),2517,"California State University, Los Angeles",Criminal Justice (degree completion program) (Criminal Justice (degree completion program) - General - DTLA Campus),1250,"California State University, Sacramento",Career and Technical Studies (Career and Technical Studies),793,University of California-Los Angeles,Geology,1877,University of California-Santa Cruz,Physics (Astrophysics),3156,University of California-Los Angeles,Biology,463,"California State University, San Bernardino",Chemistry (Chemistry),874,"California State University, Chico",Business Information Systems (Business Analytics),784,California State University Maritime Academy,Marine Engineering Technology (Marine Engineering Technology - General),2607,,,,"California State University, Monterey Bay",Computer Science (Game Development),1191,,,,"California State University, Stanislaus",Ethnic Studies (General),1704,,,,,,,University of California-Santa Barbara,Portuguese,3285,University of California-San Diego,History,1993,"California State University, Chico",Liberal Studies (General Online (Degree Completion)),2443,San Diego State University,Journalism (Media Studies),2264,"California State Polytechnic University, Humboldt",Political Science (Law and Policy),3244,California State University San Marcos,Social Sciences (General),3491,,,,"California State Polytechnic University, Pomona",Construction Engineering and Management (Construction Engineering and Management),1224,,,,,,,"California Polytechnic State University, San Luis Obispo",Recreation Parks and Tourism Administration (Event Planning and Experience Management),3423,,,,"California State University, Sacramento",Child and Adolescent Development (Educational Contexts),932,"California State University, Chico",Nursing (General),2975,San Francisco State University,Biology (Physiology),515,,,,"California State University, Northridge",Mathematics (Secondary Teaching),2706,University of California-San Diego,Mathematics and Economics (joint major),2720,,
,,,University of California-Santa Cruz,Environmental Studies/Biology,1665,,,,"California Polytechnic State University, San Luis Obispo",Art and Design (Photography and Video),302,,,,"California State Polytechnic University, Humboldt",Music (Performance),2896,"California State University, Los Angeles",Television Film and Media Studies (Media Studies),3678,University of California-Riverside,"Theatre, Film and Digital Production",3688,University of California-San Diego,Mathematics â€” Secondary Education,2642,"California State University, Stanislaus",Criminal Justice (Forensic Science),1251,"California State University, San Bernardino",Career and Technical Studies (General),794,"California State University, Stanislaus",Geology (Applied Geology),1878,University of California-San Diego,Physics with Specialization in Astrophysics,3200,University of California-Riverside,Biology,464,"California State University, San Bernardino",Chemistry (Chemistry),875,"California State University, Chico",Business Information Systems (Management Information Systems),785,University of California-Los Angeles,Materials Engineering,2616,,,,"California Polytechnic State University, San Luis Obispo",Computer Science (Game Development),1192,,,,"California State University, Sacramento",Ethnic Studies (Native American Studies),1705,,,,,,,University of California-Berkeley,Spanish and Portuguese,3640,University of California-Santa Barbara,History,1994,"California State Polytechnic University, Pomona",Liberal Studies (General Studies),2444,"California State University, Chico",Journalism (News),2265,"California State University, Northridge",Political Science (Public Policy and Management),3269,"California State University, San Bernardino",Social Sciences (Geography (Online)),3492,,,,"California State University, Chico",Construction Management (Construction Management - General),1225,,,,,,,"California Polytechnic State University, San Luis Obispo",Recreation Parks and Tourism Administration (Individualized Course of Study),3424,,,,San Francisco State University,Child and Adolescent Development (Elementary Education Teaching Pre-Credential),933,San Francisco State University,Nursing (General),2976,Sonoma State University,Biology (Physiology),516,,,,San Diego State University,Mathematics (Single Subject Teaching (Imperial Valley Campus)),2707,University of California-San Diego,Mathematics and Economics (joint major),2721,,
,,,University of California-Santa Cruz,Environmental Studies/Earth Sciences,1666,,,,"California Polytechnic State University, San Luis Obispo",Art and Design (Studio Art),303,,,,"California State University, Long Beach",Music (Performance),2897,"California State University, Los Angeles",Television Film and Media Studies (Production),3679,University of California-San Diego,Theatre,3689,"California State University, Chico",Mathematics (Foundational Mathematics Education),2661,"California State University, Los Angeles",Criminal Justice (General),1252,"California State University, San Bernardino",Career and Technical Studies (General),795,"California State University, San Bernardino",Geology (Environmental Geology),1879,"California State University, Los Angeles",Art (Fashion Fiber and Materials),246,University of California-Santa Barbara,Biology,465,San José State University,Chemistry (Chemistry),876,"California State University, Chico",Business Information Systems (Operations and Supply Chain Management),786,"California Polytechnic State University, San Luis Obispo",Materials Engineering (Materials Engineering - General),2617,,,,"California State University, Bakersfield",Computer Science (General),1193,,,,"California State University, Sacramento",Ethnic Studies (Pan-African Studies),1706,,,,,,,University of California-Los Angeles,Spanish and Portuguese,3641,University of California-Santa Cruz,History,1995,"California State University, Chico",Liberal Studies (General),2445,"California State Polytechnic University, Humboldt",Journalism (News),2266,University of California-San Diego,Political Science: Public Policy,3282,"California State University, San Bernardino",Social Sciences (Geography),3493,,,,"California State University, East Bay",Construction Management (Construction Management - General),1226,,,,,,,San Francisco State University,Recreation Parks and Tourism Administration (Recreation Parks and Tourism Administration - General),3425,,,,California State University San Marcos,Child and Adolescent Development (General),934,"California State University, Los Angeles",Nursing (Nursing - Accelerated - General),2977,"California State University, Chico",Exercise Physiology (Exercise Physiology - General),1715,,,,San Diego State University,Mathematics (Single Subject Teaching (San Diego Campus)),2708,University of California-Los Angeles,Mathematics/Economics (Pre),2727,,
,,,University of California-Santa Cruz,Environmental Studies/Economics,1667,,,,University of California-Santa Cruz,Art and Design: Games and Playable Media,304,,,,"California State Polytechnic University, Pomona",Music (Performance),2898,"California State University, Los Angeles",Television Film and Media Studies (Writing),3680,"California State University, Fullerton",Theatre (Acting),3690,"California State University, Chico",Mathematics (Mathematics Education - Credential Path),2683,"California State University, San Bernardino",Criminal Justice (General),1253,"California State University, Fresno",City and Regional Planning (City and Regional Planning - General),989,"California State University, Los Angeles",Geology (Environmental Geoscience),1880,"California State University, Long Beach",Chemistry (Materials Science),895,University of California-Santa Cruz,Biology,466,San José State University,Chemistry (Chemistry),877,"California State University, Los Angeles",Computer Information Systems (Business Systems),1156,San José State University,Materials Engineering (Materials Engineering),2618,,,,"California State University, Los Angeles",Computer Science (General),1194,,,,"California State University, Sacramento",Ethnic Studies (Teachers in Bilingual Education),1707,,,,,,,University of California-Riverside,Lanuages and Literatures/Russian,2375,University of California-Santa Cruz,History,1996,"California State University, San Bernardino",Liberal Studies (General),2446,"California Polytechnic State University, San Luis Obispo",Journalism (News),2267,University of California-Irvine,Public Health Policy,3383,"California State University, Stanislaus",Social Sciences (Interdepartmental Studies),3494,,,,"California State University, Fresno",Construction Management (Construction Management - General),1227,,,,,,,"California Polytechnic State University, San Luis Obispo",Recreation Parks and Tourism Administration (Sport and Recreation Management),3426,,,,San José State University,Child and Adolescent Development (Preparation for Teaching),935,San Diego State University,Nursing (Nursing - General),2978,University of California-Davis,"Neurobiology, Physiology and Behavior",2958,,,,"California State University, Bakersfield",Mathematics (Statistics),2709,University of California-Berkeley,Political Economy,3223,,
